{
  "schema_version": "obs.agent_context.v1",
  "context_id": "agent-context-R-TEST",
  "run_id": "R-TEST",
  "target_dossier": {},
  "evidence_index": {},
  "recommended_refs": [],
  "raw_refs": {},
  "data_quality": {
    "dropped": false,
    "drop_count": 0,
    "throttled": false,
    "missing": [],
    "truncated": false,
    "clock_confidence": "medium",
    "notes": []
  },
  "context_budget": {}
}
